{
  "schemaVersion": "1.0", "bankId": "cn-civil-service-demo", "bankVersion": "2026.09.15.1", "name": "行测 V1 合法示例", "description": "用于协议验证，不含脏数据测试。", "exportedAt": "2026-09-15T00:00:00Z", "publisher": "civil-service-question-admin",
  "media": [
    {"externalId":"media-figure-stem","type":"IMAGE","role":"STEM","path":"media/figure-stem.png","url":null},
    {"externalId":"media-figure-a","type":"IMAGE","role":"OPTION","path":"media/figure-a.png","url":null},
    {"externalId":"media-figure-b","type":"IMAGE","role":"OPTION","path":"media/figure-b.png","url":null},
    {"externalId":"media-chart-001","type":"CHART","role":"MATERIAL","path":"media/material-001-chart.png","url":null},
    {"externalId":"media-table-001","type":"TABLE","role":"MATERIAL","path":"media/material-001-table.png","url":null}
  ],
  "knowledgePoints": [
    {"externalId":"kp-data-analysis","name":"资料分析","parentExternalId":null,"level":1,"type":"MODULE"},
    {"externalId":"kp-growth","name":"增长","parentExternalId":"kp-data-analysis","level":2,"type":"KNOWLEDGE_POINT"},
    {"externalId":"kp-growth-rate","name":"增长率","parentExternalId":"kp-growth","level":3,"type":"KNOWLEDGE_POINT"},
    {"externalId":"kp-base-value","name":"基期量","parentExternalId":"kp-growth","level":3,"type":"KNOWLEDGE_POINT"},
    {"externalId":"kp-figure","name":"图形推理","parentExternalId":null,"level":1,"type":"MODULE"},
    {"externalId":"kp-common","name":"常识判断","parentExternalId":null,"level":1,"type":"MODULE"}
  ],
  "materials": [{"externalId":"material-001","title":null,"content":"根据以下资料回答问题：某地区经济保持增长。","media":["media-chart-001","media-table-001"],"provenance":{"content":{"provider":"official","sourceType":"REAL_EXAM","sourceName":"2025年国家公务员考试行测原卷","sourceUrl":null,"originalId":"2025-guokao-material-1","sourceRecordId":null,"sourceFile":"2025-guokao.pdf","sourcePage":17,"credibility":"S","license":null,"copyrightNote":null},"answer":null,"analysis":null}}],
  "questions": [
    {"externalId":"q-common-001","questionType":"SINGLE_CHOICE","content":{"stem":"下列四大发明说法正确的是？","media":[],"options":[{"key":"A","text":"造纸术由蔡伦最早发明","media":[]},{"key":"B","text":"活字印刷术由毕昇发明","media":[]},{"key":"C","text":"指南针最早用于航海","media":[]},{"key":"D","text":"火药最早用于军事","media":[]}],"correctAnswer":["B"],"explanation":"毕昇发明活字印刷术。"},"classification":{"module":"常识判断","subtype":"人文常识","knowledgePointExternalIds":["kp-common"],"sourceTags":[],"sourceDifficulty":null,"referenceTimeSeconds":30},"materialExternalId":null,"paperContext":{"exam":"国家公务员考试","year":2025,"province":null,"paperType":"行测","paperName":"2025年国考","originalQuestionNumber":"1","section":"常识判断"},"provenance":{"content":{"provider":"official","sourceType":"REAL_EXAM","sourceName":"2025年国家公务员考试行测原卷","sourceUrl":null,"originalId":"2025-guokao-1","sourceRecordId":null,"sourceFile":"2025-guokao.pdf","sourcePage":1,"credibility":"S","license":null,"copyrightNote":null},"answer":{"provider":"official","sourceType":"REAL_EXAM","sourceName":"官方答案","sourceUrl":null,"originalId":"2025-guokao-answer-1","sourceRecordId":null,"sourceFile":"2025-guokao-answer.pdf","sourcePage":1,"credibility":"S","license":null,"copyrightNote":null},"analysis":{"provider":"institution-x","sourceType":"INSTITUTION","sourceName":"机构解析","sourceUrl":"https://example.org/analysis/1","originalId":null,"sourceRecordId":null,"sourceFile":null,"sourcePage":null,"credibility":"B","license":null,"copyrightNote":null}},"answerStatus":"VERIFIED","flags":{"isActive":true}},
    {"externalId":"q-material-001","questionType":"SINGLE_CHOICE","content":{"stem":"根据材料，该地区经济运行情况是？","media":[],"options":[{"key":"A","text":"保持增长","media":[]},{"key":"B","text":"持续下降","media":[]},{"key":"C","text":"完全停滞","media":[]},{"key":"D","text":"无法判断","media":[]}],"correctAnswer":["A"],"explanation":null},"classification":{"module":"资料分析","subtype":"综合分析","knowledgePointExternalIds":["kp-growth-rate","kp-base-value"],"sourceTags":["材料题"],"sourceDifficulty":{"value":"hard","scale":"provider-original","provider":"official"},"referenceTimeSeconds":90},"materialExternalId":"material-001","paperContext":null,"provenance":{"content":{"provider":"official","sourceType":"REAL_EXAM","sourceName":"2025年国家公务员考试行测原卷","sourceUrl":null,"originalId":"2025-guokao-41","sourceRecordId":null,"sourceFile":"2025-guokao.pdf","sourcePage":17,"credibility":"S","license":null,"copyrightNote":null},"answer":{"provider":"official","sourceType":"REAL_EXAM","sourceName":"官方答案","sourceUrl":null,"originalId":"2025-guokao-41","sourceRecordId":null,"sourceFile":"2025-guokao-answer.pdf","sourcePage":3,"credibility":"S","license":null,"copyrightNote":null},"analysis":null},"answerStatus":"VERIFIED","flags":{"isActive":true}},
    {"externalId":"q-material-002","questionType":"SINGLE_CHOICE","content":{"stem":"根据图表，哪项结论正确？","media":[],"options":[{"key":"A","text":"图表显示增长","media":[]},{"key":"B","text":"图表显示下降","media":[]},{"key":"C","text":"图表没有数据","media":[]},{"key":"D","text":"无法判断","media":[]}],"correctAnswer":["A"],"explanation":"由材料图表可得。"},"classification":{"module":"资料分析","subtype":"图表分析","knowledgePointExternalIds":["kp-growth-rate"],"sourceTags":[],"sourceDifficulty":null,"referenceTimeSeconds":null},"materialExternalId":"material-001","paperContext":null,"provenance":{"content":{"provider":"official","sourceType":"REAL_EXAM","sourceName":"2025年国家公务员考试行测原卷","sourceUrl":null,"originalId":"2025-guokao-42","sourceRecordId":null,"sourceFile":"2025-guokao.pdf","sourcePage":18,"credibility":"S","license":null,"copyrightNote":null},"answer":{"provider":"official","sourceType":"REAL_EXAM","sourceName":"官方答案","sourceUrl":null,"originalId":"2025-guokao-42","sourceRecordId":null,"sourceFile":"2025-guokao-answer.pdf","sourcePage":3,"credibility":"S","license":null,"copyrightNote":null},"analysis":null},"answerStatus":"VERIFIED","flags":{"isActive":true}},
    {"externalId":"q-figure-001","questionType":"SINGLE_CHOICE","content":{"stem":"请选择最符合规律的一项。","media":["media-figure-stem"],"options":[{"key":"A","text":null,"media":["media-figure-a"]},{"key":"B","text":null,"media":["media-figure-b"]},{"key":"C","text":"图形 C","media":[]},{"key":"D","text":"图形 D","media":[]}],"correctAnswer":["B"],"explanation":"观察图形旋转规律。"},"classification":{"module":"判断推理","subtype":"图形推理","knowledgePointExternalIds":["kp-figure"],"sourceTags":[],"sourceDifficulty":null,"referenceTimeSeconds":45},"materialExternalId":null,"paperContext":null,"provenance":{"content":{"provider":"manual","sourceType":"MANUAL","sourceName":"人工审核录入","sourceUrl":null,"originalId":"figure-001","sourceRecordId":"admin-figure-001","sourceFile":null,"sourcePage":null,"credibility":"A","license":null,"copyrightNote":null},"answer":{"provider":"manual","sourceType":"MANUAL","sourceName":"人工复核答案","sourceUrl":null,"originalId":"figure-001","sourceRecordId":"admin-answer-figure-001","sourceFile":null,"sourcePage":null,"credibility":"A","license":null,"copyrightNote":null},"analysis":null},"answerStatus":"VERIFIED","flags":{"isActive":true}}
  ]
}
